{
  "schema": "dta.diff/1",
  "base": "origin/plan/token-engine-overhaul (3f02117)",
  "verdict": "fail",
  "review": {
    "verdict": "fail",
    "changed": 9,
    "explained": 6,
    "tokens": [
      {
        "id": "action.bg (Theme · Light)",
        "before": {
          "raw": "{blueprint.600}",
          "resolved": "#2f55d4"
        },
        "after": {
          "raw": "{blueprint.700}",
          "resolved": "#2443ac"
        },
        "stories": [
          "button--variants@1280",
          "button--variants@390",
          "redline--radius@1280",
          "redline--spacing@1280",
          "workflow-rail--default@1280",
          "workflow-rail--default@390"
        ],
        "needsReview": true
      }
    ],
    "unexplained": [
      {
        "story": "chip--states@1280",
        "ratio": 0.0004638671875,
        "pixels": 475,
        "region": {
          "x": 33,
          "y": 59,
          "width": 946,
          "height": 28
        },
        "failing": true
      },
      {
        "story": "diff-card--review@1280",
        "ratio": 0.00691015625,
        "pixels": 153,
        "region": {
          "x": 348,
          "y": 84,
          "width": 710,
          "height": 28
        },
        "failing": true
      },
      {
        "story": "diff-card--blocked@1280",
        "ratio": 0.0001494140625,
        "pixels": 153,
        "region": {
          "x": 340,
          "y": 84,
          "width": 718,
          "height": 28
        },
        "failing": true
      }
    ],
    "added": [],
    "removed": []
  },
  "tokens": {
    "counts": {
      "changed": 1,
      "added": 0,
      "removed": 0,
      "affected": 0
    },
    "changes": [
      {
        "kind": "changed",
        "collection": "Theme",
        "mode": "Light",
        "name": "action.bg",
        "type": "color",
        "before": {
          "raw": "{blueprint.600}",
          "resolved": "#2f55d4"
        },
        "after": {
          "raw": "{blueprint.700}",
          "resolved": "#2443ac"
        }
      }
    ]
  },
  "stories": [
    {
      "id": "button--variants",
      "title": "Primary, outline, link",
      "url": "/stories/button/variants/",
      "viewport": 1280,
      "status": "changed",
      "ratio": 0.006078125,
      "changedPixels": 6224,
      "attribution": {
        "explained": true,
        "tokens": [
          {
            "id": "action.bg (Theme · Light)",
            "dependents": 2,
            "pixels": 6224,
            "elements": [
              "button.dta-button"
            ],
            "regions": [
              {
                "x": 33,
                "y": 59,
                "width": 130,
                "height": 48
              },
              {
                "x": 330,
                "y": 59,
                "width": 97,
                "height": 48
              }
            ]
          }
        ],
        "unexplainedPixels": 0,
        "canvas": {
          "width": 1280,
          "height": 800
        },
        "ms": 590
      },
      "images": {
        "base": "base/button--variants@1280.png",
        "head": "head/button--variants@1280.png",
        "diff": "diff/button--variants@1280.png"
      }
    },
    {
      "id": "button--variants",
      "title": "Primary, outline, link",
      "url": "/stories/button/variants/",
      "viewport": 390,
      "status": "changed",
      "ratio": 0.01994871794871795,
      "changedPixels": 6224,
      "attribution": {
        "explained": true,
        "tokens": [
          {
            "id": "action.bg (Theme · Light)",
            "dependents": 2,
            "pixels": 6224,
            "elements": [
              "button.dta-button"
            ],
            "regions": [
              {
                "x": 33,
                "y": 59,
                "width": 130,
                "height": 48
              },
              {
                "x": 33,
                "y": 119,
                "width": 97,
                "height": 48
              }
            ]
          }
        ],
        "unexplainedPixels": 0,
        "canvas": {
          "width": 390,
          "height": 800
        },
        "ms": 583
      },
      "images": {
        "base": "base/button--variants@390.png",
        "head": "head/button--variants@390.png",
        "diff": "diff/button--variants@390.png"
      }
    },
    {
      "id": "command-button--default",
      "title": "Copyable command",
      "url": "/stories/command-button/default/",
      "viewport": 1280,
      "status": "unchanged",
      "ratio": 0,
      "changedPixels": 0,
      "images": {
        "base": "base/command-button--default@1280.png",
        "head": "head/command-button--default@1280.png"
      }
    },
    {
      "id": "command-button--default",
      "title": "Copyable command",
      "url": "/stories/command-button/default/",
      "viewport": 390,
      "status": "unchanged",
      "ratio": 0,
      "changedPixels": 0,
      "images": {
        "base": "base/command-button--default@390.png",
        "head": "head/command-button--default@390.png"
      }
    },
    {
      "id": "chip--states",
      "title": "Info, changed, pass",
      "url": "/stories/chip/states/",
      "viewport": 1280,
      "status": "changed",
      "ratio": 0.0004638671875,
      "changedPixels": 475,
      "attribution": {
        "explained": false,
        "tokens": [],
        "unexplainedPixels": 475,
        "canvas": {
          "width": 1280,
          "height": 800
        },
        "unexplainedRegion": {
          "x": 33,
          "y": 59,
          "width": 946,
          "height": 28
        },
        "ms": 576
      },
      "images": {
        "base": "base/chip--states@1280.png",
        "head": "head/chip--states@1280.png",
        "diff": "diff/chip--states@1280.png"
      }
    },
    {
      "id": "text-field--default",
      "title": "Label, field, help",
      "url": "/stories/text-field/default/",
      "viewport": 1280,
      "status": "unchanged",
      "ratio": 0,
      "changedPixels": 0,
      "images": {
        "base": "base/text-field--default@1280.png",
        "head": "head/text-field--default@1280.png"
      }
    },
    {
      "id": "text-field--default",
      "title": "Label, field, help",
      "url": "/stories/text-field/default/",
      "viewport": 390,
      "status": "unchanged",
      "ratio": 0,
      "changedPixels": 0,
      "images": {
        "base": "base/text-field--default@390.png",
        "head": "head/text-field--default@390.png"
      }
    },
    {
      "id": "terminal--diff",
      "title": "Output of dta diff",
      "url": "/stories/terminal/diff/",
      "viewport": 1280,
      "status": "unchanged",
      "ratio": 0,
      "changedPixels": 0,
      "images": {
        "base": "base/terminal--diff@1280.png",
        "head": "head/terminal--diff@1280.png"
      }
    },
    {
      "id": "terminal--diff",
      "title": "Output of dta diff",
      "url": "/stories/terminal/diff/",
      "viewport": 390,
      "status": "unchanged",
      "ratio": 0,
      "changedPixels": 0,
      "images": {
        "base": "base/terminal--diff@390.png",
        "head": "head/terminal--diff@390.png"
      }
    },
    {
      "id": "redline--radius",
      "title": "Measuring a radius",
      "url": "/stories/redline/radius/",
      "viewport": 1280,
      "status": "changed",
      "ratio": 0.00854296875,
      "changedPixels": 8748,
      "attribution": {
        "explained": true,
        "tokens": [
          {
            "id": "action.bg (Theme · Light)",
            "dependents": 1,
            "pixels": 8748,
            "elements": [
              "button.dta-button"
            ],
            "regions": [
              {
                "x": 230,
                "y": 194,
                "width": 190,
                "height": 48
              }
            ]
          }
        ],
        "unexplainedPixels": 0,
        "canvas": {
          "width": 1280,
          "height": 800
        },
        "ms": 590
      },
      "images": {
        "base": "base/redline--radius@1280.png",
        "head": "head/redline--radius@1280.png",
        "diff": "diff/redline--radius@1280.png"
      }
    },
    {
      "id": "redline--spacing",
      "title": "Measuring a length",
      "url": "/stories/redline/spacing/",
      "viewport": 1280,
      "status": "changed",
      "ratio": 0.0002060546875,
      "changedPixels": 211,
      "attribution": {
        "explained": true,
        "tokens": [
          {
            "id": "action.bg (Theme · Light)",
            "dependents": 1,
            "pixels": 211,
            "elements": [
              "div.bar"
            ],
            "regions": [
              {
                "x": 276,
                "y": 107,
                "width": 98,
                "height": 26
              }
            ]
          }
        ],
        "unexplainedPixels": 0,
        "canvas": {
          "width": 1280,
          "height": 800
        },
        "ms": 575
      },
      "images": {
        "base": "base/redline--spacing@1280.png",
        "head": "head/redline--spacing@1280.png",
        "diff": "diff/redline--spacing@1280.png"
      }
    },
    {
      "id": "diff-card--review",
      "title": "Change to review",
      "url": "/stories/diff-card/review/",
      "viewport": 1280,
      "status": "changed",
      "ratio": 0.00691015625,
      "changedPixels": 7076,
      "attribution": {
        "explained": false,
        "tokens": [
          {
            "id": "action.bg (Theme · Light)",
            "dependents": 1,
            "pixels": 6923,
            "elements": [
              "button.dta-button"
            ],
            "regions": [
              {
                "x": 58,
                "y": 277,
                "width": 156,
                "height": 48
              }
            ]
          }
        ],
        "unexplainedPixels": 153,